title,url,type,content,sentiment,date
Airbus shortlists 8 sites for H125 helicopter final assembly line in India,https://www.moneycontrol.com/news/business/airbus-shortlists-8-sites-for-h125-helicopter-final-assembly-line-in-india-2-12774766.html,Companies,european major airbus shortlisted eight sites india setting final assembly line h125 helicopters groundbreaking ceremony facility expected later year facility fourth final assembly line fal single engine h125 initially produce 10 helicopters annually capacity ramped depending market demand airbus officials said india market future helicopters present market extremely embryonic small compared potential could olivier michalon executive vice president global business airbus helicopters said groundbreaking ceremony fal expected october november year facility operational 2026 delivery anticipated start towards end 2026 identified eight sites currently assessing still final assessment stage position announce shortly want attractive ecosystem best suited industrial activities logistics employees course regulations michalon said briefing marignane last week marignane headquarters airbus helicopters airbus h125 mostsold helicopter india well south asia region airbus projected demand h125 helicopters india neighbouring countries 500 next 20 years targeting 10 helicopters per year demand picks ramp head airbus helicopters india south asia sunny guglani said briefing michalon stressed 10 might sound like lot could 20 30 50 years depending market demand manufacture sell support helicopters also manufacture sell support solutions provide make india solutions said highlighting success story narrowbody a320 aircraft michalon said h125 a320 h125 carry six people airbus also setting fal c295 aircraft vadodara gujarat around 350 civil parapublic helicopters india south asia india nepal bhutan bangladesh sri lanka maldives less 250 helicopters service india per airbus india 100 airbus helicopters majority h125 130s 4300 h125 helicopters flying around world fal india make us competitive terms lead time delivery time also help us address growth indian market possibly demand neighbouring nations important strategic decision impact global footprint michalon said basic model h125 helicopter could cost around 32 million euros according company official india helicopters used tourism pilgrimage medical services well energy sector private entities set india fal h125 helicopters undertake integration major component assemblies avionics mission systems installation electrical harnesses hydraulic circuits flight controls dynamic components fuel system engine besides fal testing qualification delivery h125 customers india region indian market michalon said regulations bit restrictive company working regulations going lighten bit skies become open either wait skies fully open big rush helicopter manufacturers demonstrate trust recognition potential india ready invest said january airbus tata group announced partnership set indias first helicopter fal private sector facility set tata advanced systems limited tasl along airbus helicopters,NEGATIVE,2024-07-22
"HUL's Q1 results seen muted, eye on segmental sales and heatwave impact",https://www.moneycontrol.com/news/business/earnings/hindustan-unilever-fmcg-profit-price-cut-12774554.html,Companies,intense heatwave price cuts stable commodity prices expected support fmcg giant hindustan unilever post flat quarter earnings july 23 according analysts track company closely according moneycontrol poll nine brokerages hindustan unilever likely report flat revenue growth higher one percent onyear rs 15205 crore net profit likely come rs 2512 crore versus rs 2500 crore seen corresponding quarter last year earnings estimates analysts polled moneycontrol narrow range positive negative surprise may trigger sharp reaction stock optimistic estimate sees indias largest consumer staples firm huls net profit jumping five percent onyear pessimistic projection suggests net profit might sink five percent divergence factors impacting earnings huls revenue likely remain flat account subdued performance across categories mainly impacted price cuts said axis securities volume growth overall demand huls products seen muted q1fy25 underlying volume growth seen singledigits according brokerages however volumes 75 percent huls business growing fmcg major likely boost volume growth fy25 fy26 said motilal oswal segmental performance across segments performance likely vary huls home care business likely growing two percent beauty personal care revenue expected fall price cuts huls food portfolio especially tea coffee functional nutrition drinks may affected tough summer prabhudas lilladher said expect strong performance laundry ooh consumption hot beverages might weak ebitda margins gross margins expected expand range 120160 basis points huls ebitda margin likely contract 10 basis points due higher advertisement spends royalty payout termination gsk consignment sale look analysts closely monitor demand metro areas tier3 towns effect raw material prices ebitda margins well growing competitive pressure unorganized players disclaimer views investment tips expressed investment experts moneycontrolcom website management moneycontrolcom advises users check certified experts taking investment decisions,NEGATIVE,2024-07-22
Coal India bags first critical mineral asset,https://www.moneycontrol.com/news/business/coal-india-bags-first-critical-mineral-asset-12774631.html,Companies,stateowned coal india monday said bagged first critical mineral asset graphite block madhya pradesh owning graphite asset give coal india advantage powering green energy transition momentum extent according statement coal india ltd cil successfully opened account domestic critical mineral asset emerging preferred bidder khattali chotti graphite block alirajpur district madhya pradesh psu said statement company accounts 80 per cent domestic coal output bagging mine cil made foray firstever noncoal mineral mining venture coal behemoth said tranche two forward auction held 9th july ministry mines said company bid quoting mining premium 15005 per cent value mineral despatch would pay state cil formally receive letter intent deposits performance security composite license issued cil year company meets formalities notice inviting tender timeline block put sale second tranche critical mine auction cil diversification portfolio bid cil poised play supporting role critical minerals domestically said country imports 69 per cent graphite needs natural synthetic enduse products currently graphite mining industry limited players offering space willing players venture business arena graphite utility anode material lithiumion battery manufacturing due relatively low cost energy density electric vehicle market energy storage systems fast gaining traction lithiumion cells used graphite big market market size graphite projected take big leap absolute demand projected shoot rate 2527 per cent fy35 current level psu earlier said mulling mining critical minerals,NEGATIVE,2024-07-22
"Fineotex Chemical raises Rs 342.55 crore through issue of shares, warrants",https://www.moneycontrol.com/news/business/fineotex-chemical-raises-rs-342-55-crore-through-issue-of-shares-warrants-12774505.html,Companies,fineotex chemical ltd manufactures speciality chemicals monday said raised rs 34255 crore issue equity shares warrants preferential basis regulatory filing company announced closure fund raising rs 34255 crore preferential allotment equity shares convertible warrants preferential allotment aligns initial tranche fund raised may 22 2024 amounting rs 1244 crore cumulative funds raised tranches total rs 3426 crore sanjay tibrewala cfo executive director fineotex chemical said capital raised invested strategically support organic inorganic growth opportunities reinforcing commitment enhancing shareholder value advancing operational excellence said,NEGATIVE,2024-07-22
HDFC Bank’s unit seeks up to $300 million in offshore loan,https://www.moneycontrol.com/news/business/hdfc-banks-unit-seeks-up-to-300-million-in-offshore-loan-12774418.html,Companies,unit hdfc bank ltd indias largest private sector lender planning borrow much 300 million according people familiar matter tighter rules nations central bank restrict domestic avenues hdb financial services ltd talks group global local banks finalize terms said people asked identified discussions private nonbanking finance companies increasingly tapping credit market overseas reserve bank india limited domestic funding sources manappuram finance ltd muthoot finance ltd piramal capital housing finance ltd among shadow financiers borrowed overseas year hdb financial offers range secured unsecured consumer loans debts tenor may range three five years pricing linked secured overnight financing rate people said funds raised central banks external commercial borrowing route caps interest rate 500 basis points benchmark rate final terms could change borrower aims sign deal bilaterally one banks currently talks people said hdb financial respond bloombergs request comment,NEGATIVE,2024-07-22
Zydus Lifesciences gets Mexican regulatory nod for cancer treatment biosimilar,https://www.moneycontrol.com/news/business/zydus-lifesciences-gets-mexican-regulatory-nod-for-cancer-treatment-biosimilar-12774393.html,Companies,zydus lifesciences ltd monday said received marketing approval mexican regulatory authority biosimilar product bhava used treatment certain types cancers mexican regulatory authority cofepris federal commission protection sanitary risk granted marketing approval bhava bevacizumab biosimilar marketed different strengths 100 mg4 ml 400 mg16 ml zydus lifesciences said regulatory filing bhava used treatment metastatic colorectal cancer mcrc nonsquamous nonsmall cell lung cancer metastatic breast cancer glioblastoma advanced andor metastatic renal cell carcinoma ovarian cancer patients added zydus managing director sharvil patel said approval granted cofepris companys first biosimilars patients latin america bring greater access affordability patients battling critical ailments developing pipeline biosimilars specifically oncology precision diagnostics access affordable therapies empowering millions patients fight cancer india said adding bhava company would begin new journey supporting patients needbased therapies latin america citing report 2020 company said total cancer cases reported mexico breast prostate colorectal thyroid amongst common cancer cases registered zydus said developed launched bevacizumab biosimilar developed inhouse research team zydus research centre zrc 2015 india brand name bryxta since estimated 50000 patients treated therapy zydus said adding 12 lifesaving biosimilars already launched market bridging unmet need affordable therapies fight cancer india,POSITIVE,2024-07-22
Wipro stock tanks 8% as weak Q1 earnings disappoint Street,https://www.moneycontrol.com/news/business/earnings/wipro-stock-tanks-8-as-weak-q1-earnings-disappoint-street-12774171.html,Companies,wipro shares fell much 8 percent july 22 company delivered weak q1 fy25 performance 1 percent quarteronquarter qoq decline consolidated revenue particularly concerning compared competitors tcs infosys reported 23 percent qoq growth wipros q1 fy25 revenue guidance q2 fy25 fell expectations citi research said q2 guidance likely disappoint investors higher expectations also read wipro adr falls 10 q1 revenue misses estimates companys consolidated revenue declined 11 percent quarter rs 219638 crore falling short moneycontrols forecast rs 22229 crore bengalurubased wipro also revised revenue guidance q2 fy25 suggesting potential sequential decline 1 percent slight growth 1 percent constant currency terms nomura buy call wipro target price rs 600 citi sell call rs 495 target price follow live blog market action however brokerages noted early recovery discretionary demand could potentially boost wipros future performance nuvama said wipro long way go order reach industry average growth brokerage expects wipro continue underperforming peers also notes low valuation high dividend yield help mitigate downside risk nuvama maintained hold rating wipro brokerage increased target price stock rs 530 rs 460 bfsi segment continued grow consumer business also picked disclaimer views investment tips expressed investment experts moneycontrolcom website management moneycontrolcom advises users check certified experts taking investment decisions,NEGATIVE,2024-07-22
Byju's founder faces reckoning as startup implodes,https://www.moneycontrol.com/news/business/byjus-founder-faces-reckoning-as-startup-implodes-12774162.html,Companies,byju raveendran indian mathematics whiz soared teacher startup billionaire educationtechnology company imploded year faces biggest test future raveendrans eponymous byjus online coaching firm rests indias courts countys biggest startup loved global investors valued 22 billion crashed 2 billion valuation 44yearold founder last week lost control company tribunal kickstarted insolvency process accused financial mismanagement compliance issues son family teachers small village south india faces reckoning test ingenuity made poster child indias startups formerly highflying company eventually brought low could pay 19 million sponsorship dues indias cricket federation prompting tribunal suspend byjus board make raveendran report courtappointed restructuring expert appeals tribunal expected hold hearing monday whether byjus insolvency process quashed former billionaire argued court company solvent insolvency could shut cost jobs 27000 staff including teachers insolvency also would bode well byjus backers dutch technology investor prosus raveendran denies allegations mismanagement wrongdoing firm recent months faced lawsuits unpaid loans boardroom battles foreign investors went public potential insolvency dramatic turn events entrepreneur described one person worked extremely passionate goaloriented person might adopt abrasive approach crisis raveendran presented suave nice polished image appearing heed advice eventually trust deficit said another executive quit last year byjus senior vice president said things improving dont worry money former executive said raveendran byjus spokesperson respond requests comment byjus downfall fair share mistakes engineer training started byjus 2011 physical classes friends urged go teaching raveendran aced premier indian management exam score 100 percentile twice according company website started would become empire wife divya gokulnath 38 former student educationobsessed india raveendran hit gold offering online teaching programs priced 100 300 got mammoth boost covid19 pandemic sent students indoors height fame 2021 wife net worth 4 billion forbes reckoned tatters behind reversal byjus meteoric success say executives advisers worked raveendran overruled associates expanded business expensive acquisitions splurging marketing slow address problems sales agents adopting aggressive tactics missell courses damaged companys reputation backing investors like general atlantic prosus facebook founder mark zuckerbergs philanthropy venture raveendran spent millions acquisitions company says 150 million students 100 countries growing fast ive accepted multiple times weve made fair share mistakes raveendran told interviewer last year world economic forum davos battled crises ceo also said decisions lay then50000 employees slash branding expenses would help strengthen lossmaking byjus turn cashflow positive every country needs byjus said,NEGATIVE,2024-07-22
Suzuki sees India’s automobile market growing fivefold by 2047,https://www.moneycontrol.com/technology/auto/suzuki-sees-indias-automobile-market-growing-fivefold-by-2047-article-12774147.html,Companies,indias car market track reach 20 million units 2047 helped promising growth battery electric vehicles suzuki motor corp executive vice president kenichi ayukawa said first goal maruti suzuki india ltd japanese carmakers subsidiary grab 50 market share 2030 around 40 fiscal year march confident indian market expand mid long term ayukawa said interview emergence india economic powerhouse expanding middle class present clear opportunity hamamatsubased manufacturer active south asian nation since 1983 found success topselling automaker models swift brezza order keep lead suzuki plans introduce firstever ev india well europe next year exhibiting mass production model upcoming auto expo india january according ayukawa well develop products invest expand network ayukawa said total 42 million passenger vehicles sold india fiscal year ended march according society indian automobile manufacturers put number ayukawas prediction perspective 31 million passenger cars sold us last year europe saw 15 million unit sales china worlds largest automobile market 26 million passenger vehicle sales according international organization motor vehicle manufacturers although suzukis planned evx premium electric vehicle carmaker also roll affordable compact models lighter batteries according ayukawa suzuki targeting 15 sales india evs 2030 added india faces environmental issues think evs grow extent ayukawa said although people paying cars used india remains priceconscious market added even car buyers starting show greater appetite crossovers sportutility vehicles according ayukawa competition tougher segment strong area tata mahindra said tata motors ltd indias thirdbiggest carmaker already taken lead fullyelectric variants popular tiago nexon models expects ev business reach profitability early 2026 suzuki focus models used everyday needs require development new types batteries according ayukawa future suzuki may embark domestic production cells next 5 10 years added collaboration india toyota motor corp forged strategic partnership suzuki 2019 stake 5 suzuki likely focus smaller cars toyota take lead bigger models ayukawa said toyotas ev technology also bolster suzukis product development added learn basic knowhow toyota gradually make ayukawa said suzuki also sees potential cars powered compressed natural gas cheaper gasoline india according ayukawa maruti suzuki sold 483000 cng cars latest fiscal period 47 year earlier although suzuki plans start operating four plants convert methane cow manure fuel cars currently run cng challenges ahead monetizing organic fertilizer remains manufacturing fuel large scale ayukawa said,POSITIVE,2024-07-22
Netweb Technologies Q1 profit jumps over 3-fold to Rs 15.4 crore,https://www.moneycontrol.com/news/business/earnings/netweb-technologies-q1-profit-jumps-over-3-fold-to-rs-15-4-crore-12773805.html,Companies,hardware company netweb technologies saturday posted threefold jump net profit rs 154 crore apriljune quarter 202425 company posted net profit rs 5 crore period year ago total income also increased rs 15321 crore reported quarter rs 602 crore june 2023 quarter ai systems emerged pivotal growth pillar contributing significantly operating revenue share increasing 146 percent quarter gone marking robust growth 146 percent yoy sanjay lodha chairman managing director netweb technologies said,POSITIVE,2024-07-20
Reliance records resilient operating and financial performance for Q1; here are top 10 key highlights,https://www.moneycontrol.com/news/business/earnings/reliance-records-resilient-operating-and-financial-performance-for-q1-here-are-top-10-key-highlights-12773442.html,Companies,reliance industries runs businesses spanning oil telecom retail reported resilient financial performance fiscal first quarter ended june 30 underscoring strength diverse businesses consolidated ebitda quarter improved year ago strong contribution consumer upstream businesses offsetting weak o2c oiltochemical operating environment mukesh dhirubhai ambani chairman managing director said reliance stock gained 20 percent year date close fridays session rs 31103 nse top 10 key highlights 1 bottom line consolidated profit quarter came rs 17448 crore declining 4 percent rs 18182 crore net recorded corresponding period previous fiscal finance cost increased 14 percent yearonyear rs 5918 crore primarily due higher interest rates depreciation rose 155 percent rs 13596 crore period expanded asset base across businesses higher network utilisation digital services business higher retail store count rampup upstream production reliance said filing exchanges tax expenses june quarter rs 5786 crore fell 53 percent rs 6112 crore year earlier 2 top line mukesh ambaniowned company registered 115 percent onyear growth gross revenue rs 257823 crore quarter higher oil product prices strong growth oil gas segment volumes steady growth consumer businesses also contributed increase revenue said 3 operating performance consolidated ebitda earnings interest tax depreciation amortisation first quarter current fiscal year 2025 stood rs 42748 crore growing 2 percent yearago period strong contribution oil gas consumer business offset weak o2c reported ebitda margin quarter 166 percent declining 181 percent period previous fiscal 4 jio platforms jio platforms contributed 134 percent gross revenue started fiscal year 2025 profit tax rs 5698 crore june quarter growing 117 percent yearago period jio becoming largest operator globally terms data traffic telecom operator continued build market leadership 33 percent yoy increase data traffic 5g business accounted 31 percent jios wireless data traffic digital services business registered impressive financial performance yearonyear continuing positive growth momentum mukesh ambani said consolidated revenue increased 128 percent rs 34548 crore quarter total subscriber base reaching 4897 crore 4485 crore including 13 crore 5g users jio largest 5g operator outside china operating front ebitda jumped 116 percent yearonyear rs 14638 crore primarily due healthy revenue growth operating leverage margin stood 497 percent quarter 502 percent period previous fiscal average revenue per user arpu rs 1817 q1fy25 increased rs 1805 q1fy24 better subscriber mix partially offset increasing mix promotional 5g traffic offered unlimited basis subscribers charged separately 5 reliance retail mukesh ambani said retail business delivered robust financial results compared last year supported consumption baskets reliance retail ventures registered revenue rs 75615 crore first quarter fy25 increasing 81 percent onyear profit rs 2549 crore 46 percent growth segments ebitda rs 5664 crore quarter grew 105 yearonyear driven increase footfalls expansion store footprint streamlining operations driving margin improvement margin improved 30 bps 85 percent period reliance said retail business expanded store network 331 new store openings taking total store count 18918 footfalls growing 189 percent yoy 296 crore 6 oiltochemical o2c segment contributed nearly 61 percent top line recorded 181 percent yearonyear growth revenue rs 157 lakh crore quarter ended june 30 primarily due higher product prices tracking 9 percent increase brent crude oil prices higher volumes supported strong domestic demand however ebitda lower 143 percent yoy rs 13093 crore account lower gasoline cracks lower downstream chemical deltas margin 83 percent quarter 115 percent yearago period total throughput june fy25 quarter increased half percent 198 mmt production meant sale grew 29 percent 177 mmt compared period previous fiscal 7 oil gas oil gas segment continued growth trajectory higher production offsetting lower yearonyear gas price realisations ambani said segment recorded revenue quarter rs 6179 crore 334 percent growth corresponding period last fiscal led higher volumes partly offset lower price realisation kg d6 cbm field reliance said average price realised kg d6 gas 927 per mmbtu metric million british thermal unit q1fy25 1081 per mmbtu q1fy24 average price realised cbm gas 1159 per mmbtu 1415 per mmbtu period segments ebitda increased 298 percent rs 5210 crore higher volumes kg d6 however margin came 843 percent 867 percent period 8 media business reliance said two biggest viewerinterest events ipl general elections helped media business record one strongest quarters network18 group terms consumer reach engagement however revenue operations 3 percent yoy rs 3141 crore due ipl revenue distributed across two quarters year media segment posted loss rs 221 crore quarter profit rs 1 crore yearago period ebitda stood rs 3 crore rs 108 crore period ipl 2024 jiocinema set new viewership benchmarks reaching 620 million viewers news18 tunedin news network general elections counting day 9 green energy reliance made significant progress implementation new energy gigafactories completion projects provide india worldclass integrated green energy ecosystem propel next leg sustainable growth ambani said 10 capital expenditure debt capital expenditure quarter ended june fy25 rs 28785 crore rs 39645 crore corresponding period previous fiscal cash cash equivalents increased rs 193 lakh crore june fy25 quarter rs 192 lakh crore june fy24 quarter net debt period dropped rs 112 lakh crore rs 126 lakh crore disclaimer moneycontrol part network18 group network18 controlled independent media trust reliance industries sole beneficiary,POSITIVE,2024-07-19
