title,url,type,content,sentiment,date
India’s digital payments system needs simpler KYC process to reach newer heights,https://www.moneycontrol.com/news/opinion/indias-digital-payments-system-needs-simpler-kyc-process-to-reach-newer-heights-12771464.html,Economy,indias digitalization journey become notable success unified payments interface upi standing globally model case study rise digital payments india 300 billion 2018 36 trillion 2024 projections double 2030 demonstrates significant transformation robust demographic expansion improved economic conditions widespread internet access strong government support digital infrastructure fuelled growth digital payments across country along upi digital payment instruments cards digital wallets also gained traction accounting around 10 current digital transaction values progress aligns reserve bank indias goal widely expand digital payments india established global leader digital payment sector accounting significant percentage worldwide transaction volumes upis acceptance several countries plans expand underscores international success decline cashbased transactions less 60 highlights widespread adoption digital payments across india upis interoperability ease use realtime settlement made preferred choice wide range transactions peertopeer transfers merchant payments upi transactions experienced remarkable growth surpassing 10 billion monthly transactions additionally countries like singapore uae mauritius oman indonesia accepting upi payments significant increase crossborder transactions using upi method payment transcending demographic categories digital payments preferred across demographics significantly changing consumer behaviours online offline transactions 2024 upi also boasts 260 million users number expected grow even smart devices becoming increasingly popular according jointly produced report kearney amazon pay 90 consumers opt digital methods online purchases 50 prefer digital payments offline transactions well digital payments especially popular discretionary spending electronics clothing footwear indicating notable shift purchasing behaviour millennials forefront adopting types digital payment instruments primary reasons widespread adoption convenience speed efficiency digital transactions additionally boomers significantly embraced digital payments higher usage cards wallets adoption rates among genders roughly equal men women using digital payments 72 transactions digital payment integration extensive urban areas smaller towns reporting 65 adoption rate larger cities around 75 emerging technologies like cobranded credit cards buy pay later bnpl schemes rapidly gaining popularity showing significant consumer awareness adoption merchants across various sectors street vendors large retail establishments also adopted digital payments constitute approximately 69 transaction volumes adoption driven need mitigate challenges like financial fraud handling cash kyc processes scope improvement future growth indias digital payments ecosystem depend increasing penetration underserved segments boosting transaction values digital means collaborative effort among stakeholders including payment providers governmental agencies service players essential sustained growth area improvement drive adoption involves simplifying know customer kyc processes currently seen cumbersome due extensive documentation verification requirements though aadhaarbased kyc exists streamlining advanced technologies identity verification biometrics artificial intelligence would securely expedite identity confirmation minimal hassle users additionally adjusting kyc requirements match risk levels different transaction types could enhance user experience without compromising security simplifying kyc would improve customer merchant experiences broaden access encouraging users adopt digital payments supportive regulatory environment india progresses towards digitalfirst economy building trust ensuring convenience crucial addressing needs consumers merchants fostering supportive regulatory environment india poised maintain leadership digital payment sector ensuring continuous growth enhancing economic inclusivity governments focus creating conducive regulatory environment fostered innovation growth digital payments sector reserve bank india rbi played pivotal role developing guidelines frameworks ensure security reliability digital transactions measures twofactor authentication tokenization payments infrastructure development fund pidf strengthened ecosystem digital payments impact extends beyond financial sector significant implications economic growth social development increased use digital transactions led greater financial transparency improve targeting government subsidies welfare schemes additionally digital payments opened new avenues financial inclusion particularly underserved segments rural populations small businesses credit insurance products designed based history upi transactions privacy concerns need addressed indias digital payments ecosystem evolves move cashless economy challenges remain collection handling vast amounts personal data payment providers raise concerns data privacy concerns data privacy increase risk cyberattacks fraud hacking also increases digital payment providers need ensure cybersecurity measures mandated protect user data maintain consumer trust digital payment ecosystem government industry stakeholders must work together enhance system resilience educate users promote responsible innovation bigger cities country relatively better digital infrastructure rural remote areas often face issues internet connectivity access digital payment services government ensure takes measures enhance digital infrastructure across country make sure uniform growth despite challenges future digital payments india promising collaborative efforts among government industry stakeholders users india continue advance digital payments ecosystem achieve greater financial inclusion economic growth india continues lead global digital payments revolution sets example nations aspiring create inclusive efficient secure financial systems,POSITIVE,2024-07-18
India's food subsidies to cost 11% more than initial plan,https://www.moneycontrol.com/news/business/economy/indias-food-subsidies-to-cost-11-more-than-initial-plan-12771149.html,Economy,india likely spend 225 trillion rupees 1197 billion food subsidies financial year four government sources said around 11 interim budget estimate february due higher spending support price farmers countrys combined food fertiliser bill expected reach 388 trillion rupees 5 rise estimate interim budget unveiled election interim budget estimates replaced new budget prime minister narendra modis government presented july 23 food fertiliser subsidies interim budget accounted 8 indias total spending 4766 trillion rupees fiscal year ends march 31 2025 interim budget food subsidy bill estimated 205 trillion rupees two sources said increase since largely due rise price government buys rice wheat domestic farmers one sources said meanwhile government likely stick previous estimate 164 trillion rupees fertiliser subsidy two sources said ministry consumer affairs food public distribution ministry finance ministry chemicals fertilizers immediately reply requests comment,NEGATIVE,2024-07-17
India needs to face up to its junk food crisis,https://www.moneycontrol.com/news/opinion/india-needs-to-face-up-to-its-junk-food-crisis-12774831.html,Politics,india worlds healthiest country sadly regulators seem determined make problem worse passing year urban indians especially wealthier ones relatively sedentary lifestyle diet heavy carbohydrates fats may show easily numbers given size countrys populationanalysis lancet recently found 23 indians technically overweight defined body mass index 25 many parts world west asia eastern europe much worse break data worrying trends emerge women 30 instance startlingly high rates abdominal obesity india prevalence 55 women older 40 dangerous indicator predisposition metabolic disease regular bmi moreover genetics seem make indians particularly vulnerable ailments one scientist generic pharma major lupin ltd pointed indians tend greater insulin resistance develop type ii diabetes younger age average lancet suggests 100 million indians diabetes 136 million prediabetic thats crisis one thats set grow worse india becomes richer urban problem usually blamed change diets middleclass indians fresh processed foods assumption packaged products unhealthier right name junk food im tiny bit skeptical addicted delhis deepfried street food sure better anything could buy supermarket time data suggesting junk food india worse many countries higher levels salt sugar saturated fats importantly packaged food regulated people least know theyre eating ideally would allow consumers better manage intake fat salt remains lot room transition india nestle india ltd claims branded food makes third indian market expand compound annual growth rate 12 coming years question whether regulators task recently announced nutritional information sugar salt saturated fat would henceforth displayed bold letters relatively increased font size labels packaged food items news generally welcomed fact represented significant climbdown new rules specify information estimated based arbitrary serving sizes percentage recommended daily intake translating good bad requires level mental math average shopper likely wont want endure regulations replace draft plan would imposed fewer requirements shoppers still flawed 2022 officials proposed star rating similar ones used indicate appliance energyefficient scientists pointed merely helps consumer choose least unhealthy option among host unhealthy options critics worry indias food regulators respond readily big food companies doctors last time backtracked warning labels placated angry consumers telling new adviser would study issue man new york times described leading institution almost entirely funded goliaths agribusiness food pharmaceutical industries processed food industry shooting foot companies want indians make switch mouthwatering street food ought welcome greater transparency consumers certain choosing healthier alternatives better models available even indias neighborhood sri lanka example sodas labeled traffic light system goes green healthy red godawful levels sugar recent research shown system consistently steers consumers towards healthier choices indians need simple easytounderstand prominent warning labels better natures given chance overtake impulses otherwise richer country unhealthier one credit bloomberg,NEGATIVE,2024-07-22
US: Democrats clear the runway for Kamala Harris,https://www.moneycontrol.com/news/opinion/us-democrats-clear-the-runway-for-kamala-harris-12774830.html,Politics,barring unexpected turn events season unexpected turns events vice president kamala harris next democratic nominee president think almost inevitable kamala harris end nominee robert shrum director center political future university southern california veteran half century democratic campaigns told president joe bidens departure race sunday one mans extraordinary decision sum efforts thousands democratic party uniformly favor jettisoning biden center gravity shifted two points especially notable fact highly relevant weeks ahead first democratic party center gravity center found second gravitational mass completed unprecedented work collective action involving party elites rank file work taking place publicly privately uncanny feat party representing tens millions individuals democrats accomplished political equivalent soaring high dive bucket water demanding party recreate act time added somersaults twists wideopen convention chicago televised traveling circus bill clinton andbarack obama interviewing aspirants nations highest office oprah something something democratic national committees convention rules committee met virtually friday reaffirmed partys virtual roll call vote nominating partys candidates president vice president would take place aug 1 aug 7 hard deadlines party must meet nominees state ballots harris looking sew support quickly consensus choice first week august party convention used remind nation donald trump likely republican lawsuits prevent biden withdrawing ballot party choosing replacement present opportunity remind voters jan 6 state mind maga land free elections risk republicans succeed bidens departure surely whet appetites ambitious democrats would like president credible challenger countered bidens reelection campaign part one wanted risk blame reality second trump presidency attendant assault democratic institutions practices political deterrent governed party behavior 2022 present continue check ambitions first week august fortunately party obvious contenders mostly young afford wait another chance three words risk party fratricide never dont apply 52yearold michigan governor gretchen whitmer 42yearold transportation secretary pete buttigieg even 56yearold california governor gavin newsom whitmer newsom viable challengers said run harris 59 restraint make already difficult challenge slightly daunting secondtier candidates contemplating run veteran democratic consultant particular affinity harris told difficult conceive rationale campaign consensus began building harris within minutes georgetown university political scientist jonathan ladd wrote social media party appears making decision fast forward leaves harris dominant position biden endorsed help influence fervent supporters task days ahead ward potential challengers consolidate support contemplate running mates vicepresidential nomination prove extremely attractive less fourmonth campaign white house virtually chance blamed defeat democracy line incentive toward another round partywide collective action strong harris fully trusted toptier candidate occasionally fumbles might lose white votes biden might claimed brings genuine strengths may excite young voters especially young women turned away biden may inspire new energy among black voters gives women different stake race day biden dropped important effectively prosecute moral intellectual political case trump primary mission lot work would best democrats got work quickly credit bloomberg,POSITIVE,2024-07-22
"'Problem in examination system': Rahul Gandhi, Akhilesh Yadav slam Pradhan over NEET row, Oppn demands resignation",https://www.moneycontrol.com/news/india/major-problem-in-examination-system-rahul-gandhi-slams-dharmendra-pradhan-opposition-demands-ministers-resignation-12774414.html,Politics,leader opposition lok sabha congress mp rahul gandhi lashed parliament monday concerning central governments handling neet paper leak row stating evident everyone significant problem examination system affecting neet major exams minister dharmendra pradhan blamed everyone doubt even grasps fundamental issues play also noted issue hand millions students country deeply concerned believe indian examination system compromised widespread perception wealth influence manipulate system sentiment also shared many opposition questioning centres handling alleged paper leaks competitive exams samajwadi party chief akhilesh yadav slammed government claiming setting new records paper leaks students nationwide protesting investigations revealing arrests made request students receive justice long minister remains office yadav stated education minister dharmendra pradhan responding allegations stated exam results released according supreme courts directions prefer engage politics records many paper leaks occurred akhilesh yadavs tenure chief minister uttar pradesh said pradhan said serving mercy leader stated government collectively answerable situation education minister defended position asserting support constituency require validation parliament condemned gandhis characterisation examination system rubbish calling unfortunate statement also said past seven years national testing agency nta conducted 240 exams 5 crore students applying 4 crore participating incidents current case supreme courts scrutiny chief justice personally overseeing proceedings besides pradhan also took dig previous government referencing remote control jab often used bjp manmohan singh administration 2010 three education reform bills introduced thenminister kapil sibal one aimed prohibit unfair practices question remains bill withdrawn due pressure private medical colleges questioned us raising issues noted opposition parties lok sabha raised concerns exam paper leaks demanding pradhans resignation scrapping neet prompting speaker om birla call constructive discussion birla stated widespread criticism could harm perception indias education system globally noted cbi supreme court already investigating leaks urged development better system rather questioning examinations following birlas remarks rahul gandhi attempted speak permitted protest lop along opposition members tmc dmk walked house congress deputy leader gaurav gogoi led slogans demanding resignation education minister dharmendra pradhan following oppositions walkout congress mp rahul gandhi said education minister dharmendra pradhan addressed issue directly instead spoke supreme court pm modi clarify actions matter neet crucial issue youth despite repeated requests parliamentary discussion government shows interest continue raise issue pressure government interaction media,NEGATIVE,2024-07-22
India must play peacemaker in bloodied Bangladesh ,https://www.moneycontrol.com/news/opinion/india-must-play-peacemaker-in-bloodied-bangladesh-12774075.html,Politics,prime minister narendra modis government cant wash hands bloodbath bangladesh 140 agitating young men already killed antiquota protests rocking neighbour india far bigger stake bangladesh country whole world upheaval whether leads regime change eventually dissipates grave implications national security therefore strategic interests sort mess war footing restore normalcy cost perfectly okay take official stand deadly turmoil bangladesh internal matter advice indian nationals steer clear trouble evacuate necessary external affairs ministry done circumstances india mustnt stop resident power onerous duties responsibilities shirk cost things stand today new delhi cant afford dither look away option take charge elder brother big brother zone influence hasinas cancelled foreign trips indicate big problem volatility gauged fact bangladeshi prime minister sheikh hasina cut short state visit china last week return home quell violent protests university students job quotas gathered momentum absence compelled cancel tour spain brazil handle increasingly dangerous state affairs indefinite national curfew shootonsight order force army paramilitary tanks armoured carriers patrolling streets mobile internet broadband service shut trains cancelled hasinas awami league administration turning densely populated muslim nation doorstep ticking time bomb fake news sympathy notably even bangladesh burned midweek reports opposition bangladesh nationalist party leaders closeted chinese embassy dhaka beijings diplomats joined pakistani high commissioner making threesome patently untrue stories obviously planted media hasinas government gain indias sympathies characterising skyrocketing turmoil handiwork colluding antiindia bnp pakistani chinese saboteurs fortunately new delhi thoroughly monitors backyard seen canards treating equal disdain fabricated reports antiquota protestors demanding termination indias access railways roads rivers country one preconditions call agitation sunday supreme court scaled back job quotas hasnt altogether abolished highly discriminatory government job reservations blatantly favour awami league triggered students rebellion judicial intervention unlikely restore normalcy immediately given high number casualties brutalities inflicted armypolice hasinas behest created chasm regime ordinary bangladeshis india needs counsel restraint foreboding scenario indias task cut without wasting time new delhi must counsel hasina control temper tongue damage loose talk especially abusivederogatory term razakar done age 76 fourterm pm speak like grandmothercumelder statesman rabble rouser hurtling country chaos anarchy secondly new delhi must become bridge hasina government protestors leaders two sides sit across table earliest put bluntly indias mediation need hour bangladesh although india known prohasina one bangladesh going rebuff india comes forward peacemaker ukraine far away lets start backyard standing alltime high india best thirdparty end spiral violence usher peace unnecessary bloodletting last days handsoff policy realisitic bangladesh far important india pursue handsoff policy critical juncture lets forget another neighbouring country like pakistan nepal bhutan sri lanka lot geographically bangladesh well truly embedded inside india save short boundary myanmar waters bay bengal south bangladesh surrounded many five indian states west bengal assam meghalaya tripura mizoram sides sense bangladesh indeed inside india therefore far important neighbour traditional sense bangladeshs domestic politics governance naturally impact india country world bangladesh boil would disastrous indias restive northeast faster act better us dear neighbour,NEGATIVE,2024-07-22
Jammu in jihadist crosshairs,https://www.moneycontrol.com/news/opinion/jammu-in-jihadist-crosshairs-12774018.html,Politics,unlike financial analysts start ringing alarm bells moment see corporate earnings either weaken line expectations quarter security analysts least policy making level seem wait problem longer explained away prefer quote statistics convince everyone everything control around 2021 series terrorist strikes region civilians also security forces yet attacks considered indicative shift area operation kashmir valley jammu recent spate ambushes security force convoys terrorists jammu region security establishment woken growing presence actions jihadist terrorists south pir panjal jk terrain hopping avoid pressure increase terrorist actions jammu surprising enormous security pressure kashmir valley shelf life terrorists reduced drastically except odd killing unarmed civilian offduty security force official parttime hybrid terrorists active kashmir therefore natural terrorists particularly foreign read pakistani terrorists shift operations jammu terrain geography provided cover well easier ingress egress routes fact close two decades jammu region cleansed terrorists also helped laser focus terrorism jammu division kashmir division around 2020 security forces thinned region redeployed active fronts created gaps security grid could exploited terrorists jammu gets reinforcements security establishment beefing troops region hunt terrorists could prove bit long haul especially last three years terrorists reestablished networks support sustenance things stand intelligence grid security forces appears rusted need made robust operations become effective engagement security forces locals critical take mean navigating political grievances people region feel ignored neglected socialcommunal tensions erupted last years intelligence vacuum solid information intelligence strength terrorists active region known garden variety hybrid terrorist common kashmir terror attacks jammu anything go highly trained disciplined battle hardened terrorists well versed laying ambushes adept hitandrun attacks trained use terrain advantage hide strike signs point pakistan army manifest attributes suggest probably serving recent retirees pakistan army perhaps special services group commandos predominantly punjabi pashtun taliban aligned pakistan army experience waged jihad afghanistan still clear surviving land receiving support form supplies information ideological religious political simply coerced locals given areas attacks taken place poonch rajauri reasi kathua doda unlikely group estimates 4050 terrorists might active operating groups fourtofive could something ruled whatever available public domain also clear terrorists receiving instructions handlers sitting pakistan occupied kashmir autonomous operations clear weapons using usmade m4 assault rifles awash arms bazaar pakistan given edge equipped night vision devices m4 ak47 afghanistan spillover sense m4 2020s ak47 1990s security forces still equipped unwieldy slrs police still carried 303 lee enfield rifles wwi vintage took long time indian security forces equip gear rifles helmets bulletproof vests suited antiinsurgency counterterrorism operations case communications equipment back 1990s terrorists used frequency hopping kenwood sets security forces vintage communication systems something similar happening today americans abandoned afghanistan known weapons left behind would find way india wont security establishment one really prepared inevitable strange reason false sense chivalry appears reluctance deploy frontline weapon systems drones helicopters etc hunt terrorists almost though saved day even security forces brace carry another operation sarp vinash jammu important security strategy reviewed use village defence councils least provide better weapons outdated 303 rifles use latest technologies available gain advantage terrorists take minimal loss personnel chivalry sacrificing forces want convince world fight like gentlemen barbarians ensure insertion new troops jammu pulling troops kashmir reducing pressure terrorists valley politicians generals need stop declaring premature victories andor underestimating downplaying terrorist threat,NEGATIVE,2024-07-22
