title,url,type,content,sentiment,date
Chemical players bet on hopes of PLI to give manufacturing boost,https://www.moneycontrol.com/news/business/markets/chemical-players-bet-on-hopes-of-pli-to-give-manufacturing-boost-12774551.html,Market,even though sector caught midst rough patch chemical companies hoping finance minister nirmala sitharaman give industry something cheer form productionlinked incentive pli scheme upcoming budget industry grappling weak demand influx lowcost chinese inventory global markets past year recovery seems imminent except agrochemicals outlook remains unclear many analysts predict rebound start becoming visible second half fiscal year industry also counting government support maximise revival axis securities anticipates continued backing pli scheme chemicals tax incentives chemical manufacturing hubs like gujarat benefiting multiple indian chemical manufacturers additionally analysts mayank maheshwari vivek rajamani morgan stanley expect incentives petrochemicals growth green hydrogen gas penetration rising demand electric vehicles evs axis securities foresees additional pli incentives battery manufacturers companies involved electric power production storage prabhudas lilladher hopes government roadmap renewable manufacturing higher ethanol blending agrochemical sector expectations customs duty imports could doubled 20 percent technicals 30 percent formulations benefiting domestic producers however nuvama analysts see little chance duty slabs altered also read budget 2024 pharma firms hope increased expenditure healthcare support rd chemical industry thriving 2022 global demand weakened chinese imports flooded international markets downturn coincided phase capital expenditure commissioned domestic players putting margins severe pressure consequently brokerages adopted cautious stance sector several chemical stocks srf deepak nitrite gujarat fluorochemicals neogen chemicals pi industries himadri specialty chemicals also red yeartodate despite signs recovery emerging significant rebound demand expected later fiscal year context government support pli schemes crucial lifting sentiment sector moves toward demand revival also read budget 2024 street eyeing fertiliser subsidy aid reduce import dependence disclaimer views investment tips expressed investment experts moneycontrolcom website management moneycontrolcom advises users check certified experts taking investment decisions,NEGATIVE,2024-07-22
"Indian GCCs employed over 16 lakh in FY23, shows Economic Survey",https://www.moneycontrol.com/technology/indian-gccs-employed-over-16-lakhs-in-fy23-shows-economic-survey-article-12774518.html,Market,global capability centres gccs india employed 166 lakh people data economic survey 202324 showed 42 percent engaged engineering research development erd 345 percent business process management bpm 234 percent information technology services document also showed revenue indias gccs increased 194 billion fy15 46 billion fy23 compound annual growth rate cagr 114 percent economic survey said promoting specialisations higher education essential incentivise gccs india recommended areas blockchain artificial intelligence ai machine learning internet things cybersecurity cloud computing big data analytics augmented reality virtual reality 3d printing web mobile development referring survey document said 76 percent employers reported difficulty finding skilled talent required globally technology sectors dynamic continually evolving positions remain among indemand roles global job market despite high demand sectors experiencing talent gap shortage data science cybersecurity workers document read revenue indias gccs increased 194 billion fy15 46 billion fy23 cagr 114 percent developing story please come back,NEGATIVE,2024-07-22
"'Tahe dil se shukriya ada karte hain…,' says Sebi chief Madhabi Puri Buch to SBI MF; here's why",https://www.moneycontrol.com/news/business/markets/tahe-dil-se-shukriya-aada-karte-hai-says-sebi-chief-madhabi-puri-buch-to-sbi-mf-heres-why-12774487.html,Market,madhabi puri buch chairperson securities exchange board india sebi lauded role sbi mutual fund played mutual fund industry years speaking event organised sbi mf july 19 mark assets management aum crossing rs 10 trillion buch said times sebi needed request government intervention establishing backstop facility mutual funds crisis situations sbi mutual fund clear choice manage initiatives also read heart beat customer sebi chief asks mutual fund distributors wanted request government provide backstop facility mutual funds event another crisis wanted institutionalise simple question run said without hesitation sbi mf run else run buch recounted sbi mutual fund special place regulator respect many instances less publicly known sebi relies relied broad shoulders sbi mutual fund way part tremendous responsibility cast us regulator said adding testament culture bank manifested subsidiary buch also praised culture bank manifested subsidiary thanked every member sbi mutual fund family support service words tahe dil se shukriya aada karte hai thank bottom heart buch added last year every time spoke mutual funds product financial inclusion capital markets want make micro sips 250rupee sip popular knew sbi would forefront knew sbi mf one mutual fund buch also praised fund house role playing ensuring stability integrity indias financial markets stepping times potential crisis fund supports regulator also bolsters investor confidence reflecting strong partnership sebi sbi mutual fund maintaining robustness mutual fund industry said answering query whether need distributors particular amc sell products amcs buch noted large number funds common benchmarks categories exhibit similar performance entity decides sell groups funds within space issue different organizations different strengths instance motilal oswal known strong equity brand sbi strong distribution network use nothing wrong however buch added selling underperforming funds misselling system must ensure happen confident sbi group takes care issue well said disclaimer views investment tips expressed investment experts moneycontrolcom website management moneycontrolcom advises users check certified experts taking investment decisions,POSITIVE,2024-07-22
"Sensex, Nifty still in red as IT and realty stocks dent sentiment; pharma and healthcare rally",https://www.moneycontrol.com/news/business/markets/sensex-nifty-still-in-red-as-it-and-realty-stocks-dent-sentiment-pharma-and-healthcare-rally-12774368.html,Market,benchmark indices nifty sensex continued trade red midday comes day union budget realty bogged sentiment 1240 pm sensex 025 percent 80402 nifty 023 percent 24475 1994 shares advanced 1480 shares declined 106 shares unchanged follow live blog market updates midcap smallcap index also known broader markets also edged higher reversing morning trends outperforming headline indices two traded 12 1 percent higher respectively industry experts suggest fullfledged profit booking took place broader market last week vix also known fear gauge rose 44 percent around 16 vix surged almost 17 percent last three months sectoral trend 13 sectors auto pharma healthcare top gainers auto index mm tata motors maruti suzuki major contributors hand fmcg realty stocks slipped ahead budget major laggard nifty wipro index comes companys consolidated revenue fell first quarter wipro shares tanked much 9 percent trade today read higher capex budget better pes happiestever capital market exit momentum jm financials vishal kampani fundamental view market consolidation phase indices recovered well low election results negative surprises market get prolonged consolidation expected trade around 24000 mark kranthi bathini director equity strategy wealthmills securities told moneycontrol said budget delivers expected market try attain 25000 coming days technical view nifty witnessed heavy profit booking resisting near new high zone 24850 levels slipped significantly form bearish candle pattern daily chart turn sentiment little bit cautious theindex would nearterm support 2420024250 zone bias would turn weak expect slide vaishali parekh vice president technical research prabhudas lilladher said sensex witnessing downward slide formed bearish engulfing pattern daily chart major support zone visible near 20 dma level 79600 near term resistance band 81500 levels volatility rise budget session nearby support day seen 79300 24100 resistance seen 82000 25000 sensex nifty read economic survey pegs fy25 gdp growth 657 key nifty gainers grasim hdfc bank infosys dr reddys labs tata consumer durables key nifty losers wipro kotak mahindra bank reliance industries itc ltimindtree key sensex gainers ntpc mm hdfc bank ultratech cement power grid corp key sensex losers wipro kotak mahindra bank reliance industries itc ltimindtree stock moves fertiliser stocks shares surged upto 13 percent runup union budget 2024 due tabled finance minister nirmala sitharaman july 23 spike fertiliser stocks came investors speculate quantum subsidy could allotted sector upcoming budget tejas network shares slipped 4 percent despite reporting strong earnings first quarter current financial yearq1fy25 company reported net profit rs 77 crore loss rs 2629 crore yearago period revenue increased 696 percent yearonyear rs 1496 crore disclaimer views investment tips expressed investment experts moneycontrolcom website management moneycontrolcom advises users check certified experts taking investment decisions,NEGATIVE,2024-07-22
Indian Hotels jumps 7% on healthy Q1 results; stock up 40% so far this year,https://www.moneycontrol.com/news/business/earnings/indian-hotels-jumps-7-on-healthy-q1-results-stock-up-40-so-far-this-year-12774339.html,Market,shares indian hotels company ihcl jumped 7 percent rs 616 apiece july 22 company reported healthy apriljune quarter q1fy25 results far year stock hospitality chain rallied 40 percent compared benchmark nifty 50s 12 percent rise earlier ihcl hit 52week high rs 663 per share june 26 2024 catch market action live blog q1fy25 companys revenue increased 57 percent onyear rs 1550 crore net profit jumped 10 percent yoy rs 260 crore operationally ebitda climbed 96 percent yoy rs 450 crore q1fy25 margins expanded 10 basis points yoy 29 percent new business verticals comprise ginger qmin ama stays trails reported revenue rs 162 crore q1fy25 37 percent previous year reimagined business tajsats chambers reported revenue rs 274 crore 17 percent yoy also read indian hotels company temporary blip q1 fy25 longterm story intact quarter ihcl opened 6 hotels seleqtions hotel mahabaleshwar vivanta jamshedpur ginger nagpur jamshedpur tree life resorts gangtok srinagar said analysts hdfc securities shared reduce call ihcl citing expensive valuations assigned target price rs 540 per share heatwaves general electionscode conduct fewer auspicious wedding dates quarter presented headwinds believe supplydemand mismatch continue favor ihcl key locations next two years allowing capitalize opportunities assetlight capacity growth strategy newly launched taj branded residences rampup earlier opened hotels robust pipeline new hotels supported demand tailwinds ensure sustained occupancy 75 percent singledigit growth average room revenue high singledigit growth revpar next two years brokerage firm stated disclaimer views investment tips expressed investment experts moneycontrolcom website management moneycontrolcom advises users check certified experts taking investment decisions,NEGATIVE,2024-07-22
Option strategy of the day | M&M shares on verge of breakout; Long call recommended,https://www.moneycontrol.com/news/business/markets/option-strategy-of-the-day-m-long-call-recommended-12774360.html,Market,mm ltd shares trading cycle higher highs higher lows poised breakout recent resistance levels daily charts 11 july 22 stock trading rs 279300 4370 points 159 percent recent price performance stock indicates strength expected continue positive momentum coming days well said arun kumar mantri founder mantri finmart capture upside potential mantri recommends taking long call strategy trade detailsposition buy mm july 2820 ceentry rs 3033target rs 5465stop loss rs 20holding period 56 trading sessions technical viewmantri highlights stock cycle higher highs higher lows verge breaking recent resistance levels daily charts recent price performance indicates strength positive momentum expected continue technical indicators suggest bullish move likely persist support stock around rs 2700 resistance rs 28802900 levels higher side said mantri mantri notes stock trading comfortably 21 50 100 200 dema daily weekly charts indicating strength leading indicators like parabolic sar macd also suggest positive trend near term derivatives datamantri observes option chain june series counter standing strong support zone rs 2750 2800 heavy put writers positioned 875 lakh shares outstanding 2800 strike put option current series recent price action accompanied good volumes even derivatives front indicating underlying strength expected remain shortterm trade added believes counter added significant open interest last session indicating upward move likely continue near term price expected test rs 28802890 levels disclaimer views investment tips expressed investment experts moneycontrolcom website management moneycontrolcom advises users check certified experts taking investment decisions,POSITIVE,2024-07-22
Fertiliser stocks surge up to 13% a day before Budget on hopes of rural focus,https://www.moneycontrol.com/news/business/markets/fertiliser-surge-subsidy-union-budget-12774354.html,Market,fertiliser stocks buzzing trade surging much 13 percent runup union budget 2024 due tabled finance minister nirmala sitharaman july 23 spike fertiliser stocks came investors speculate quantum subsidy could allotted sector upcoming budget interim budget estimated fertiliser subsidy requirement fy25 rs 164 lakh crore lower rs 189 lakh crore fy24 street anticipating increase subsidy bill industry participants expecting finance minister may retain previously estimated subsidy allocation budgeted amount considered adequate fy25 due moderation input costs prices finished products reduced subsidy bill compared fy24 enable government allocate funds productive areas axis securities wrote note brokerage expects government increase funding towards reducing dependence fertiliser imports developing new capabilities nano urea follow live blog updates experts anticipating greater emphasis boosting rural consumption primarily higher spending governments flagship programmes rebound rural consumption benefit fertiliser companies would likely lead increased spending farmers crop protection riding high expectations shares deepak fertilisers chambal fertilisers chemicals national fertilizers gujarat state fertilizers fertilisers chemicals travancore fact coromandel international trading 313 percent nse fertiliser companies faced disappointing earnings fy24 due weak prices subdued demand influx lowcost chinese supplies global market led significant decline profitability straining net profit revenue major players however signs recovery emerged recent quarters expectations resurgence demand latter half current fiscal coinciding sowing rabi crop backdrop fertilizer industry relying hopes governments support stage strong rebound later fiscal disclaimer views investment tips expressed investment experts moneycontrolcom website management moneycontrolcom advises users check certified experts taking investment decisions,NEGATIVE,2024-07-22
"Analysts bullish on RIL after earnings meet estimates; brokerages expect growth in Jio, rebound in energy",https://www.moneycontrol.com/news/business/markets/analysts-bullish-on-ril-after-earnings-meet-estimates-brokerages-expect-growth-in-jio-rebound-in-energy-12774375.html,Market,reliance industries ltd stock received bullish calls brokerages buoyed strong growth prospects telecom unit likely rebound energy business following companys fiscal firstquarter earnings nomura buy call reliance industries stock price target rs 3600 implying 16 percent upside last closing price nomura analysts said reliances o2c oiltochemicals business delivered well challenging environment also said operational trends remain strong reliance industries citing rise 20 basis points overall margins yearonyear july 19 reliance industries reported 115 per cent increase revenue rs 258 lakh crore first quarter current fiscal year ago bolstered contributions across segments consolidated ebitda rose 2 percent yearago period rs 42748 crore however o2c business ebitda declined also read niftys overvaluation signals imminent correction says emkay even reliances o2c business results line expectations according jefferies reliance industries said strong contributions consumer upstream businesses offset weak o2c operating environment among consumer businesses reliances jio results met expectations jefferies added jio see strong growth back tariff hike said jio platforms revenue operations rose 128 percent year earlier rs 29449 crore quarter ended june 30 segments ebitda increased rs 14638 crore company said average revenue per user arpu rs 1817 better subscriber mix jefferies morgan stanley buy overweight calls ril shares price targets rs 3525 rs 3540 respectively energy telecom segments see rebound coming quarters morgan stanley said reliances retail business revenue grew 66 percent ebitda rose rs 5664 crore management rationalising unprofitable parts retail focus margins jefferies said reliances pivot retail focus margin amid weak domestic demand stands morgan stanley said macquarie neutral call reliance industries stock target price rs 2750 per share companys followthrough capex discipline free cash flow improvement would positive rils capital expenditure quarter stood rs 28785 crore comfortably covered cash profit rs 33757 crore disclosure moneycontrol part network18 group network18 controlled independent media trust reliance industries sole beneficiary disclaimer views investment tips expressed investment experts moneycontrolcom website management moneycontrolcom advises users check certified experts taking investment decisions,NEGATIVE,2024-07-22
"Taking Stock: Sensex, Nifty close flat ahead of Union Budget; mid, smallcaps shine",https://www.moneycontrol.com/news/business/markets/taking-stock-sensex-nifty-end-flat-ahead-of-union-budget-mid-smallcaps-shine-12774828.html,Stocks,indian benchmark indices ended lower second consecutive session july 22 amid selling heavyweights traders cautious day ahead union budget announcements close sensex 7943 points 010 percent 8052522 nifty 2160 points 009 percent 2450930 back weak global cues indian indices opened lower slipped 24400 however witnessed recovery initial hours traded red throughout session biggest nifty losers included wipro kotak mahindra bank reliance industries itc sbi life insurance gainers grasim industries hdfc bank dr reddys labs tata consumer infosys sectoral front auto capital goods healthcare metal power indices went 1 percent selling seen media bank realty fmcg bse midcap index added 13 percent smallcap index rose 08 percent 170 stocks touched 52week high bse including britannia industries deepak nitrite glenmark pharma emami colgate palmolive mtnl nitin spinners zydus wellness dodla dairy among click view full list outlook july 23 aditya gaggar director progressive shares oversold condition coupled bullish divergence rsi saved index steep fall mixed market activity seen mid smallcaps soared higher index stayed wellmaintained range end session 2450925 marginal loss 2165 points auto pharma sectors advanced 1 become outperformers day realty major laggard followed considering union budget outcome wild swings expected sides 24200 considered immediate support higher side seems capped 24800 disclaimer views investment tips expressed investment experts moneycontrolcom website management moneycontrolcom advises users check certified experts taking investment decisions,NEGATIVE,2024-07-22
Gainers & losers: Stocks and sectors that moved the most on July 22,https://www.moneycontrol.com/news/business/markets/gainers-losers-stocks-and-sectors-that-moved-the-most-on-july-22-12774839.html,Stocks,indian benchmark indices witnessed volatile session july investors exercised caution ahead union budget 2024 finance minister nirmala sitharaman due table budget july 23 investors eagerly waiting see glimpse modi 30 offer close sensex 10257 points 013 percent 8050208 nifty 2160 points 009 percent 2450930 1969 shares rose 1567 fell 111 shares unchanged ihcl cmp rs 620 stock jumped 7 percent company reported healthy apriljune quarter q1fy25 results q1fy25 companys revenue increased 57 percent onyear rs 1550 crore net profit jumped 10 percent 10 percent yoy rs 260 crore kotak mahindra bank cmp rs 176245 investors booked profits kotak mahindra bank causing stock drop 3 percent lender reported strong q1 fy25 results despite brokerages offered mixed opinions stock citing uncertainty timeline lifting reserve bank indias rbi digital banking ban keeping margin loan growth outlook check paytm cmp rs 45260 shares fell 2 percent fintech reported weak result quarter ended june 2024 one 97 communications reported net loss widened twoand half times onyear rs 839 crorerevenue operations declined 36 percent onyear rs 1502 crore q1fy25 company continues cope impact rbi curbs shutting payments bank business tejas networks cmp rs 1319 shares tanked 6 percent even company reported strong earnings first quarter current financial yearq1fy25 company reported net profit rs 77 crore loss rs 2629 crore yearago period revenue increased 696 percent yearonyear rs 1496 crore fertiliser stocks surged much 13 percent runup union budget 2024 due tabled finance minister nirmala sitharaman july 23the spike fertiliser stocks came investors speculate quantum subsidy could allotted sector upcoming budget interim budget estimated fertiliser subsidy requirement fy25 rs 164 lakh crore lower rs 189 lakh crore fy24 oberoi realty cmp rs 174490 shares soared much 44 percent companys solid earnings performance apriljune quarter fy25 real estate majors net profit surged close 82 percent year rs 58450 crore q1 fy25 rs 32160 crore recorded corresponding quarter preceding fiscal sharp uptick net profit aided robust revenue growth 544 percent rs 140520 crore quarter review rs 910 crore yearago period yes bank cmp rs 2562 shares jumped 34 percent buoyed lenders strong earnings performance apriljune quarter fy25 lender reported sharp jump 47 percent year net profit q1 fy25 rs 502 crore sequential basis net profit rose 112 percent spike net profit fuelled sharp decline provisions fell 40 percent year rs 21180 crore due release provisions security receipts portfolio carries high provision coverage ratio jubilant pharmova cmp rs 72130 share price fell almost 4 percent early trade companys canada facility received voluntary action indicated vai status us food drug administration us fda wipro cmp rs 50535 shares fell much 93 percent company delivered weak q1 fy25 performance 1 percent quarteronquarter qoq decline consolidated revenue anant raj cmp rs 517 share price rose nearly 8 percent company entered memorandum understanding mou google llc american global technology company anant raj cloud whollyowned subsidiary company entered mou google llc collaborate providing data center infrastructure dc managed services cloud platform various public private enterprises company also develop innovative technological solutions potential customers,NEGATIVE,2024-07-22
